{
  "schemaVersion": 1,
  "stage": "dirty-opencode2-conversion-import",
  "source": {
    "repository": "https://github.com/ByBrawe/opencode-loop.git",
    "commit": "925b599cfab213c1e5198046d468021137c8f9fe",
    "dirty": true
  },
  "files": [
    {
      "sourcePath": ".github/workflows/ci.yml",
      "repositoryPath": ".github/workflows/ci.yml",
      "sha256": "41af84b7bcafc12c6aa336c3e703187036a274d048891c54021357c882cd6f56"
    },
    {
      "sourcePath": ".github/workflows/publish-npm.yml",
      "repositoryPath": ".github/workflows/publish-npm.yml",
      "sha256": "e51f8fac86d182f95e9df96544552ff72070182d348be566a826020a1c01d094"
    },
    {
      "sourcePath": ".github/workflows/release.yml",
      "repositoryPath": ".github/workflows/release.yml",
      "sha256": "6bfd6cb0c7834b2372af9ea6b83823febec695091799f96e657b0f1a60f62efc"
    },
    {
      "sourcePath": ".gitignore",
      "repositoryPath": ".gitignore",
      "sha256": "89e584289f8f2400ece19830586c19a446fe9ab201322494e02a308642d637f1"
    },
    {
      "sourcePath": "CHANGELOG.md",
      "repositoryPath": "CHANGELOG.md",
      "sha256": "20ea1538d1307accf1e4c4e872934d55d9d8af9e5e6ca3428b88e21ac37dbf28"
    },
    {
      "sourcePath": "LICENSE",
      "repositoryPath": "LICENSE",
      "sha256": "8ae3cce6bd44d6ccaeda05e0c14fa5865ff25c4ea41d0dcc53769d7e0cb6e41c"
    },
    {
      "sourcePath": "README.md",
      "repositoryPath": "README.md",
      "sha256": "8da01b94c599608181216049199132315be096439d225c6c38d8aedb2af8c557"
    },
    {
      "sourcePath": "agents/opencode-loop-local.md",
      "repositoryPath": "agents/opencode-loop-local.md",
      "sha256": "38815030f0dd9cc3f771adb7b677ffbbee5b6ae18e32f84ad10d1361d2efaafa"
    },
    {
      "sourcePath": "commands/loop-ask.md",
      "repositoryPath": "commands/loop-ask.md",
      "sha256": "0583d04de0d4d179b5abcee07b5510b3aefa99b1de25257e72f02dba759c5653"
    },
    {
      "sourcePath": "commands/loop-clear.md",
      "repositoryPath": "commands/loop-clear.md",
      "sha256": "bb8ea046cc272c219479b09ed89273f46ef3ec4b114a37454a93ecfcd9ea08bb"
    },
    {
      "sourcePath": "commands/loop-cmd.md",
      "repositoryPath": "commands/loop-cmd.md",
      "sha256": "d62e4d71409e864822bf572997432c41c26591d9a883ca5d8efac4f9a359ec90"
    },
    {
      "sourcePath": "commands/loop-command.md",
      "repositoryPath": "commands/loop-command.md",
      "sha256": "77bace70636904e60180c2e4063672a70bc46d0cc2d5e247363293ad3d935666"
    },
    {
      "sourcePath": "commands/loop-compact.md",
      "repositoryPath": "commands/loop-compact.md",
      "sha256": "33a1f6eb0d0105d2e93a340a3a317d84bddc22ce4ce9cb883873886b45d8a097"
    },
    {
      "sourcePath": "commands/loop-dev.md",
      "repositoryPath": "commands/loop-dev.md",
      "sha256": "3ca5aa944ee5c79f1eef5735f33c5e5d7acd9d3130d9dbd85e61d11d8283dfc6"
    },
    {
      "sourcePath": "commands/loop-doctor.md",
      "repositoryPath": "commands/loop-doctor.md",
      "sha256": "a7072ba762d4487628fdf962986ee3185599aea59e246232f0a6062facf4dcf9"
    },
    {
      "sourcePath": "commands/loop-export.md",
      "repositoryPath": "commands/loop-export.md",
      "sha256": "34cccb8da60f128be7be662f334fbb27776f58e7880054581159b537ac577107"
    },
    {
      "sourcePath": "commands/loop-goal-blocked.md",
      "repositoryPath": "commands/loop-goal-blocked.md",
      "sha256": "522eb67a2e235ebad4c74ccb7853fe94b26ad96536599e500a9d61144dcda3e1"
    },
    {
      "sourcePath": "commands/loop-goal-clear.md",
      "repositoryPath": "commands/loop-goal-clear.md",
      "sha256": "db89ef7e7f2de83c8574a6cce368958c019feb232c47985c3b36d964fb9ad671"
    },
    {
      "sourcePath": "commands/loop-goal-done.md",
      "repositoryPath": "commands/loop-goal-done.md",
      "sha256": "1d09b7492389a846e8e1560686b5856200dabea6c3c2cc20386bd8477aa5fa73"
    },
    {
      "sourcePath": "commands/loop-goal-pause.md",
      "repositoryPath": "commands/loop-goal-pause.md",
      "sha256": "bef02fc3e919d8b7c4c7be329ae2e1387d15f70f9010f86ccfc6bd180d814fc7"
    },
    {
      "sourcePath": "commands/loop-goal-resume.md",
      "repositoryPath": "commands/loop-goal-resume.md",
      "sha256": "7a5eadd4d504aaefc791e46e58007b2863674399c4d44a297b4f9d2df9da1f2d"
    },
    {
      "sourcePath": "commands/loop-goal-status.md",
      "repositoryPath": "commands/loop-goal-status.md",
      "sha256": "a37ab77289f719e0dead8a91e4817ca7d9e678b61573f17daf65772d68779caa"
    },
    {
      "sourcePath": "commands/loop-goal.md",
      "repositoryPath": "commands/loop-goal.md",
      "sha256": "e70240b2e3023544a072b9d7beae2822d96bfab54cdce27c56927ff515ce474e"
    },
    {
      "sourcePath": "commands/loop-help.md",
      "repositoryPath": "commands/loop-help.md",
      "sha256": "1b29ebbad18cf7d8c48b0919ff4e69b57e5e4d06264a1c94fe2eaa9b035d55c3"
    },
    {
      "sourcePath": "commands/loop-init.md",
      "repositoryPath": "commands/loop-init.md",
      "sha256": "c2d9d81b8a857597f475a69d829db800c7d38b61e28eaf6b9aa59c11f10025c1"
    },
    {
      "sourcePath": "commands/loop-logs.md",
      "repositoryPath": "commands/loop-logs.md",
      "sha256": "e6834f3069ad94aca82042425447aca661dcdceca9b1334a4189ed546a7af712"
    },
    {
      "sourcePath": "commands/loop-now.md",
      "repositoryPath": "commands/loop-now.md",
      "sha256": "55d46579f336192f68b4a44f92a3c808c644cd2aa2d7bd32d92d757f4d6233f2"
    },
    {
      "sourcePath": "commands/loop-pause.md",
      "repositoryPath": "commands/loop-pause.md",
      "sha256": "01921e458a980e2b035d14455d9dcda47403ec17b02574a05735911f0c66a489"
    },
    {
      "sourcePath": "commands/loop-progress.md",
      "repositoryPath": "commands/loop-progress.md",
      "sha256": "06ce3cb8b3fab09d4de521adc04cf9e13521ee8aaf0a10e92b258523f0d34ddf"
    },
    {
      "sourcePath": "commands/loop-prompt.md",
      "repositoryPath": "commands/loop-prompt.md",
      "sha256": "bb2db50e995242c29732241723c29633a2d6b92c59c6592c48de76159d087c5c"
    },
    {
      "sourcePath": "commands/loop-remove.md",
      "repositoryPath": "commands/loop-remove.md",
      "sha256": "8cd63d116f6ab95c97d45257793a09100e24042d8504a58253edf8cb5ce55432"
    },
    {
      "sourcePath": "commands/loop-resume.md",
      "repositoryPath": "commands/loop-resume.md",
      "sha256": "19078c7d3f39d85df35d8a0672679a0cb0ac61d89134619d032beb33ab9b034b"
    },
    {
      "sourcePath": "commands/loop-safe-dev.md",
      "repositoryPath": "commands/loop-safe-dev.md",
      "sha256": "1a649f93939264ec57bc0d5904b763291b7d102be79e49fc017c7087ab9e3a91"
    },
    {
      "sourcePath": "commands/loop-shell.md",
      "repositoryPath": "commands/loop-shell.md",
      "sha256": "bd3eda47428c6026d1b6420517a590b3fb53584a0af4ab8c653284fb4707474c"
    },
    {
      "sourcePath": "commands/loop-status.md",
      "repositoryPath": "commands/loop-status.md",
      "sha256": "e387f83ccac9981de5fcfce21cf84c1e913bc33f88d08ecd851e0928cef1506a"
    },
    {
      "sourcePath": "commands/loop-stop.md",
      "repositoryPath": "commands/loop-stop.md",
      "sha256": "11895e8e2ef8e046c24efe1cd3f58458a16a3507843b7f9d67976d6a662a0a05"
    },
    {
      "sourcePath": "commands/loop-testfix.md",
      "repositoryPath": "commands/loop-testfix.md",
      "sha256": "c9b77194bf5c87bb696ae27c46c19038a6b600f92fcc56ab10807746552dbba1"
    },
    {
      "sourcePath": "commands/loop.md",
      "repositoryPath": "commands/loop.md",
      "sha256": "f5ed748d97f9277ad652b1a9d009077a1c2c56d6c53823510521bfb298490589"
    },
    {
      "sourcePath": "examples/loop-prompt.md",
      "repositoryPath": "examples/loop-prompt.md",
      "sha256": "c57d12b4da218eda10ef5b705e7668f0fdde55cef35e8dd184651eec3206dcad"
    },
    {
      "sourcePath": "examples/opencode.json",
      "repositoryPath": "examples/opencode.json",
      "sha256": "e44a7e3727bb2fcc57ca2ec08e6cdc01627687a8d2bb3b58a2e80bc923ec4090"
    },
    {
      "sourcePath": "package-lock.json",
      "repositoryPath": "package-lock.json",
      "sha256": "1e68660ead635d6d03c86724ae6c6ff701fd6f357758177385c0574501f079a7"
    },
    {
      "sourcePath": "package.json",
      "repositoryPath": "package.json",
      "sha256": "2d259dc10668f947cd2b13fd36f3498c8ecc2cacfa45805c57084f4815b28354"
    },
    {
      "sourcePath": "scripts/comprehensive-test.mjs",
      "repositoryPath": "scripts/comprehensive-test.mjs",
      "sha256": "0da9d618193c1fd26d58b2c068d1000be2f48c644f438bb21eb715882b97b2c1"
    },
    {
      "sourcePath": "scripts/install-node.mjs",
      "repositoryPath": "scripts/install-node.mjs",
      "sha256": "86125461c891c14874663984d444028ffd54af993bc3fdcfe3c5e59ed082572c"
    },
    {
      "sourcePath": "scripts/install-test.mjs",
      "repositoryPath": "scripts/install-test.mjs",
      "sha256": "b435fc3bf756c2641e31ab61cc8d6f0c6571b8f7dd4f8fca948a10885634552d"
    },
    {
      "sourcePath": "scripts/install.ps1",
      "repositoryPath": "scripts/install.ps1",
      "sha256": "9f1d43d561274b644dbcfc7a578b4049de7d6d623663b1fee1a3950929d8e53d"
    },
    {
      "sourcePath": "scripts/install.sh",
      "repositoryPath": "scripts/install.sh",
      "sha256": "dc27f98a50113c73e6e8e9adc88fb3c0eedd727e7ac664c8e53226feafef0c2a"
    },
    {
      "sourcePath": "scripts/loopd-test.mjs",
      "repositoryPath": "scripts/loopd-test.mjs",
      "sha256": "de87acdf23a8b3879e718f268949fc996fdb7eedf56703467aa5123aa2e77c7c"
    },
    {
      "sourcePath": "scripts/loopd.mjs",
      "repositoryPath": "scripts/loopd.mjs",
      "sha256": "067db353be685f08052c404f2f587f960103110bff45a8df0c9d61bd883fd228"
    },
    {
      "sourcePath": "scripts/make-zip.mjs",
      "repositoryPath": "scripts/make-zip.mjs",
      "sha256": "53939219d6260ff5a8e64365c0748ab0cbe58a2bf9c074d34813a8af123b3006"
    },
    {
      "sourcePath": "scripts/smoke-test.mjs",
      "repositoryPath": "scripts/smoke-test.mjs",